{
  "audit": {
    "integrity_level": "full",
    "profile_id": "lerobot-core",
    "rule_pack_version": "openbot.dataset_audit.rules.v1",
    "schema_version": "openbot.dataset_audit.v1"
  },
  "checked_at": "2026-07-28T12:00:00Z",
  "coverage": {
    "audit_contract": {
      "capabilities": [
        {
          "capability": "advisory.measurements",
          "checked": 1,
          "integrity": "full",
          "omitted": [],
          "selected": [
            "data/chunk-000/file-000.parquet"
          ],
          "status": "complete",
          "total": 1
        },
        {
          "capability": "alignment.data_relations",
          "checked": 1,
          "integrity": "full",
          "omitted": [],
          "selected": [],
          "status": "complete",
          "total": 1
        },
        {
          "capability": "alignment.episode_ranges",
          "checked": 1,
          "integrity": "full",
          "omitted": [],
          "selected": [],
          "status": "complete",
          "total": 1
        },
        {
          "capability": "alignment.task_foreign_keys",
          "checked": 1,
          "integrity": "full",
          "omitted": [],
          "selected": [
            "data/chunk-000/file-000.parquet"
          ],
          "status": "complete",
          "total": 1
        },
        {
          "capability": "alignment.timestamps",
          "checked": 1,
          "integrity": "full",
          "omitted": [],
          "selected": [
            "data/chunk-000/file-000.parquet"
          ],
          "status": "complete",
          "total": 1
        },
        {
          "capability": "alignment.video_relations",
          "checked": 0,
          "integrity": "full",
          "omitted": [],
          "selected": [],
          "status": "complete",
          "total": 0
        },
        {
          "capability": "content.checksum",
          "checked": 0,
          "integrity": "full",
          "omitted": [],
          "selected": [],
          "status": "complete",
          "total": 0
        },
        {
          "capability": "data.indexes",
          "checked": 1,
          "integrity": "full",
          "omitted": [],
          "selected": [
            "data/chunk-000/file-000.parquet"
          ],
          "status": "complete",
          "total": 1
        },
        {
          "capability": "data.inventory",
          "checked": 1,
          "integrity": "full",
          "omitted": [],
          "selected": [],
          "status": "complete",
          "total": 1
        },
        {
          "capability": "data.parquet_footer",
          "checked": 1,
          "integrity": "full",
          "omitted": [],
          "selected": [
            "data/chunk-000/file-000.parquet"
          ],
          "status": "complete",
          "total": 1
        },
        {
          "capability": "data.parquet_rows",
          "checked": 1,
          "integrity": "full",
          "omitted": [],
          "selected": [
            "data/chunk-000/file-000.parquet"
          ],
          "status": "complete",
          "total": 1
        },
        {
          "capability": "data.parquet_schema",
          "checked": 1,
          "integrity": "full",
          "omitted": [],
          "selected": [
            "data/chunk-000/file-000.parquet"
          ],
          "status": "complete",
          "total": 1
        },
        {
          "capability": "format.contract",
          "checked": 1,
          "integrity": "full",
          "omitted": [],
          "selected": [],
          "status": "complete",
          "total": 1
        },
        {
          "capability": "media.declared_contract",
          "checked": 0,
          "integrity": "full",
          "omitted": [],
          "selected": [],
          "status": "complete",
          "total": 0
        },
        {
          "capability": "media.decode",
          "checked": 0,
          "integrity": "full",
          "omitted": [],
          "selected": [],
          "status": "complete",
          "total": 0
        },
        {
          "capability": "media.inventory",
          "checked": 0,
          "integrity": "full",
          "omitted": [],
          "selected": [],
          "status": "complete",
          "total": 0
        },
        {
          "capability": "media.metadata",
          "checked": 0,
          "integrity": "full",
          "omitted": [],
          "selected": [],
          "status": "complete",
          "total": 0
        },
        {
          "capability": "metadata.episode_indexes",
          "checked": 1,
          "integrity": "full",
          "omitted": [],
          "selected": [
            "meta/episodes/chunk-000/file-000.parquet"
          ],
          "status": "complete",
          "total": 1
        },
        {
          "capability": "metadata.episodes",
          "checked": 1,
          "integrity": "full",
          "omitted": [],
          "selected": [],
          "status": "complete",
          "total": 1
        },
        {
          "capability": "metadata.info",
          "checked": 1,
          "integrity": "full",
          "omitted": [],
          "selected": [],
          "status": "complete",
          "total": 1
        },
        {
          "capability": "metadata.stats",
          "checked": 0,
          "integrity": "full",
          "omitted": [],
          "reason": "Optional file missing.",
          "reason_code": "optional_file_missing",
          "selected": [],
          "status": "unavailable",
          "total": 1
        },
        {
          "capability": "metadata.tasks",
          "checked": 1,
          "integrity": "full",
          "omitted": [],
          "selected": [],
          "status": "complete",
          "total": 1
        },
        {
          "capability": "metadata.totals",
          "checked": 1,
          "integrity": "full",
          "omitted": [],
          "selected": [
            "meta/info.json"
          ],
          "status": "complete",
          "total": 1
        },
        {
          "capability": "source.identity",
          "checked": 1,
          "integrity": "full",
          "omitted": [],
          "selected": [],
          "status": "complete",
          "total": 1
        },
        {
          "capability": "stats.recomputed",
          "checked": 2,
          "integrity": "full",
          "omitted": [],
          "reason": "Statistics were recomputed but no stored values exist to compare.",
          "reason_code": "stored_stats_unavailable",
          "selected": [
            "action",
            "observation.state"
          ],
          "status": "partial",
          "total": 2
        },
        {
          "capability": "stats.stored",
          "checked": 0,
          "integrity": "full",
          "omitted": [
            "meta/stats.json"
          ],
          "reason": "Optional normalization statistics are absent.",
          "reason_code": "optional_file_missing",
          "selected": [],
          "status": "unavailable",
          "total": 1
        }
      ]
    },
    "capabilities": {
      "annotation_quality": "complete",
      "content_checksum": "complete",
      "dataset_discovery": "complete",
      "downstream_pipeline": "skipped",
      "media_decode": "complete",
      "media_metadata": "complete",
      "policy_readiness": "complete"
    },
    "checksum": "sha256",
    "episodes": {
      "discovered": 1,
      "with_declared_length": 1
    },
    "integrity_level": "full",
    "readiness_contract": {
      "capabilities": [
        {
          "capability": "advisory.measurements",
          "checked": 1,
          "integrity": "full",
          "omitted": [],
          "selected": [
            "data/chunk-000/file-000.parquet"
          ],
          "status": "complete",
          "total": 1
        },
        {
          "capability": "alignment.data_relations",
          "checked": 1,
          "integrity": "full",
          "omitted": [],
          "selected": [],
          "status": "complete",
          "total": 1
        },
        {
          "capability": "alignment.episode_ranges",
          "checked": 1,
          "integrity": "full",
          "omitted": [],
          "selected": [],
          "status": "complete",
          "total": 1
        },
        {
          "capability": "alignment.task_foreign_keys",
          "checked": 1,
          "integrity": "full",
          "omitted": [],
          "selected": [
            "data/chunk-000/file-000.parquet"
          ],
          "status": "complete",
          "total": 1
        },
        {
          "capability": "alignment.timestamps",
          "checked": 1,
          "integrity": "full",
          "omitted": [],
          "selected": [
            "data/chunk-000/file-000.parquet"
          ],
          "status": "complete",
          "total": 1
        },
        {
          "capability": "alignment.video_relations",
          "checked": 0,
          "integrity": "full",
          "omitted": [],
          "selected": [],
          "status": "complete",
          "total": 0
        },
        {
          "capability": "content.checksum",
          "checked": 0,
          "integrity": "full",
          "omitted": [],
          "selected": [],
          "status": "complete",
          "total": 0
        },
        {
          "capability": "data.indexes",
          "checked": 1,
          "integrity": "full",
          "omitted": [],
          "selected": [
            "data/chunk-000/file-000.parquet"
          ],
          "status": "complete",
          "total": 1
        },
        {
          "capability": "data.inventory",
          "checked": 1,
          "integrity": "full",
          "omitted": [],
          "selected": [],
          "status": "complete",
          "total": 1
        },
        {
          "capability": "data.parquet_footer",
          "checked": 1,